No.     Time        Source                Destination           Protocol Length Info
   2140 18.969328   192.168.12.66         10.144.0.1            DNS      92     Standard query 0x3ba2 A exp1.rnea.comm.eng.osaka-u.ac.jp

Frame 2140: 92 bytes on wire (736 bits), 92 bytes captured (736 bits) on interface 0
    Interface id: 0 (eth0)
        Interface name: eth0
    Encapsulation type: Ethernet (1)
    Arrival Time: May 11, 2021 15:14:02.461052120 JST
    [Time shift for this packet: 0.000000000 seconds]
    Epoch Time: 1620713642.461052120 seconds
    [Time delta from previous captured frame: 0.016055910 seconds]
    [Time delta from previous displayed frame: 0.000000000 seconds]
    [Time since reference or first frame: 18.969328233 seconds]
    Frame Number: 2140
    Frame Length: 92 bytes (736 bits)
    Capture Length: 92 bytes (736 bits)
    [Frame is marked: False]
    [Frame is ignored: False]
    [Protocols in frame: eth:ethertype:ip:udp:dns]
    [Coloring Rule Name: UDP]
    [Coloring Rule String: udp]
Ethernet II, Src: Raspberr_9e:bc:b3 (b8:27:eb:9e:bc:b3), Dst: AlaxalaN_00:00:0c (00:12:e2:00:00:0c)
    Destination: AlaxalaN_00:00:0c (00:12:e2:00:00:0c)
        Address: AlaxalaN_00:00:0c (00:12:e2:00:00:0c)
        .... ..0. .... .... .... .... = LG bit: Globally unique address (factory default)
        .... ...0 .... .... .... .... = IG bit: Individual address (unicast)
    Source: Raspberr_9e:bc:b3 (b8:27:eb:9e:bc:b3)
        Address: Raspberr_9e:bc:b3 (b8:27:eb:9e:bc:b3)
        .... ..0. .... .... .... .... = LG bit: Globally unique address (factory default)
        .... ...0 .... .... .... .... = IG bit: Individual address (unicast)
    Type: IPv4 (0x0800)
Internet Protocol Version 4, Src: 192.168.12.66, Dst: 10.144.0.1
    0100 .... = Version: 4
    .... 0101 = Header Length: 20 bytes (5)
    Differentiated Services Field: 0x00 (DSCP: CS0, ECN: Not-ECT)
        0000 00.. = Differentiated Services Codepoint: Default (0)
        .... ..00 = Explicit Congestion Notification: Not ECN-Capable Transport (0)
    Total Length: 78
    Identification: 0x82b0 (33456)
    Flags: 0x4000, Don't fragment
        0... .... .... .... = Reserved bit: Not set
        .1.. .... .... .... = Don't fragment: Set
        ..0. .... .... .... = More fragments: Not set
    Fragment offset: 0
    Time to live: 64
    Protocol: UDP (17)
    Header checksum: 0xe073 [validation disabled]
    [Header checksum status: Unverified]
    Source: 192.168.12.66
    Destination: 10.144.0.1
User Datagram Protocol, Src Port: 34238, Dst Port: 53
    Source Port: 34238
    Destination Port: 53
    Length: 58
    Checksum: 0xd7c6 [unverified]
    [Checksum Status: Unverified]
    [Stream index: 36]
Domain Name System (query)
    Transaction ID: 0x3ba2
    Flags: 0x0100 Standard query
        0... .... .... .... = Response: Message is a query
        .000 0... .... .... = Opcode: Standard query (0)
        .... ..0. .... .... = Truncated: Message is not truncated
        .... ...1 .... .... = Recursion desired: Do query recursively
        .... .... .0.. .... = Z: reserved (0)
        .... .... ...0 .... = Non-authenticated data: Unacceptable
    Questions: 1
    Answer RRs: 0
    Authority RRs: 0
    Additional RRs: 0
    Queries
        exp1.rnea.comm.eng.osaka-u.ac.jp: type A, class IN
            Name: exp1.rnea.comm.eng.osaka-u.ac.jp
            [Name Length: 32]
            [Label Count: 7]
            Type: A (Host Address) (1)
            Class: IN (0x0001)
    [Response In: 2142]

No.     Time        Source                Destination           Protocol Length Info
   2141 18.969419   192.168.12.66         10.144.0.1            DNS      92     Standard query 0x43a2 AAAA exp1.rnea.comm.eng.osaka-u.ac.jp

Frame 2141: 92 bytes on wire (736 bits), 92 bytes captured (736 bits) on interface 0
    Interface id: 0 (eth0)
        Interface name: eth0
    Encapsulation type: Ethernet (1)
    Arrival Time: May 11, 2021 15:14:02.461143526 JST
    [Time shift for this packet: 0.000000000 seconds]
    Epoch Time: 1620713642.461143526 seconds
    [Time delta from previous captured frame: 0.000091406 seconds]
    [Time delta from previous displayed frame: 0.000091406 seconds]
    [Time since reference or first frame: 18.969419639 seconds]
    Frame Number: 2141
    Frame Length: 92 bytes (736 bits)
    Capture Length: 92 bytes (736 bits)
    [Frame is marked: False]
    [Frame is ignored: False]
    [Protocols in frame: eth:ethertype:ip:udp:dns]
    [Coloring Rule Name: UDP]
    [Coloring Rule String: udp]
Ethernet II, Src: Raspberr_9e:bc:b3 (b8:27:eb:9e:bc:b3), Dst: AlaxalaN_00:00:0c (00:12:e2:00:00:0c)
    Destination: AlaxalaN_00:00:0c (00:12:e2:00:00:0c)
        Address: AlaxalaN_00:00:0c (00:12:e2:00:00:0c)
        .... ..0. .... .... .... .... = LG bit: Globally unique address (factory default)
        .... ...0 .... .... .... .... = IG bit: Individual address (unicast)
    Source: Raspberr_9e:bc:b3 (b8:27:eb:9e:bc:b3)
        Address: Raspberr_9e:bc:b3 (b8:27:eb:9e:bc:b3)
        .... ..0. .... .... .... .... = LG bit: Globally unique address (factory default)
        .... ...0 .... .... .... .... = IG bit: Individual address (unicast)
    Type: IPv4 (0x0800)
Internet Protocol Version 4, Src: 192.168.12.66, Dst: 10.144.0.1
    0100 .... = Version: 4
    .... 0101 = Header Length: 20 bytes (5)
    Differentiated Services Field: 0x00 (DSCP: CS0, ECN: Not-ECT)
        0000 00.. = Differentiated Services Codepoint: Default (0)
        .... ..00 = Explicit Congestion Notification: Not ECN-Capable Transport (0)
    Total Length: 78
    Identification: 0x82b1 (33457)
    Flags: 0x4000, Don't fragment
        0... .... .... .... = Reserved bit: Not set
        .1.. .... .... .... = Don't fragment: Set
        ..0. .... .... .... = More fragments: Not set
    Fragment offset: 0
    Time to live: 64
    Protocol: UDP (17)
    Header checksum: 0xe072 [validation disabled]
    [Header checksum status: Unverified]
    Source: 192.168.12.66
    Destination: 10.144.0.1
User Datagram Protocol, Src Port: 34238, Dst Port: 53
    Source Port: 34238
    Destination Port: 53
    Length: 58
    Checksum: 0xd7c6 [unverified]
    [Checksum Status: Unverified]
    [Stream index: 36]
Domain Name System (query)
    Transaction ID: 0x43a2
    Flags: 0x0100 Standard query
        0... .... .... .... = Response: Message is a query
        .000 0... .... .... = Opcode: Standard query (0)
        .... ..0. .... .... = Truncated: Message is not truncated
        .... ...1 .... .... = Recursion desired: Do query recursively
        .... .... .0.. .... = Z: reserved (0)
        .... .... ...0 .... = Non-authenticated data: Unacceptable
    Questions: 1
    Answer RRs: 0
    Authority RRs: 0
    Additional RRs: 0
    Queries
        exp1.rnea.comm.eng.osaka-u.ac.jp: type AAAA, class IN
            Name: exp1.rnea.comm.eng.osaka-u.ac.jp
            [Name Length: 32]
            [Label Count: 7]
            Type: AAAA (IPv6 Address) (28)
            Class: IN (0x0001)
    [Response In: 2143]

No.     Time        Source                Destination           Protocol Length Info
   2142 18.970377   10.144.0.1            192.168.12.66         DNS      108    Standard query response 0x3ba2 A exp1.rnea.comm.eng.osaka-u.ac.jp A 192.168.12.23

Frame 2142: 108 bytes on wire (864 bits), 108 bytes captured (864 bits) on interface 0
    Interface id: 0 (eth0)
        Interface name: eth0
    Encapsulation type: Ethernet (1)
    Arrival Time: May 11, 2021 15:14:02.462101854 JST
    [Time shift for this packet: 0.000000000 seconds]
    Epoch Time: 1620713642.462101854 seconds
    [Time delta from previous captured frame: 0.000958328 seconds]
    [Time delta from previous displayed frame: 0.000958328 seconds]
    [Time since reference or first frame: 18.970377967 seconds]
    Frame Number: 2142
    Frame Length: 108 bytes (864 bits)
    Capture Length: 108 bytes (864 bits)
    [Frame is marked: False]
    [Frame is ignored: False]
    [Protocols in frame: eth:ethertype:ip:udp:dns]
    [Coloring Rule Name: UDP]
    [Coloring Rule String: udp]
Ethernet II, Src: AlaxalaN_00:00:0c (00:12:e2:00:00:0c), Dst: Raspberr_9e:bc:b3 (b8:27:eb:9e:bc:b3)
    Destination: Raspberr_9e:bc:b3 (b8:27:eb:9e:bc:b3)
        Address: Raspberr_9e:bc:b3 (b8:27:eb:9e:bc:b3)
        .... ..0. .... .... .... .... = LG bit: Globally unique address (factory default)
        .... ...0 .... .... .... .... = IG bit: Individual address (unicast)
    Source: AlaxalaN_00:00:0c (00:12:e2:00:00:0c)
        Address: AlaxalaN_00:00:0c (00:12:e2:00:00:0c)
        .... ..0. .... .... .... .... = LG bit: Globally unique address (factory default)
        .... ...0 .... .... .... .... = IG bit: Individual address (unicast)
    Type: IPv4 (0x0800)
Internet Protocol Version 4, Src: 10.144.0.1, Dst: 192.168.12.66
    0100 .... = Version: 4
    .... 0101 = Header Length: 20 bytes (5)
    Differentiated Services Field: 0x00 (DSCP: CS0, ECN: Not-ECT)
        0000 00.. = Differentiated Services Codepoint: Default (0)
        .... ..00 = Explicit Congestion Notification: Not ECN-Capable Transport (0)
    Total Length: 94
    Identification: 0x71c1 (29121)
    Flags: 0x0000
        0... .... .... .... = Reserved bit: Not set
        .0.. .... .... .... = Don't fragment: Not set
        ..0. .... .... .... = More fragments: Not set
    Fragment offset: 0
    Time to live: 254
    Protocol: UDP (17)
    Header checksum: 0x7352 [validation disabled]
    [Header checksum status: Unverified]
    Source: 10.144.0.1
    Destination: 192.168.12.66
User Datagram Protocol, Src Port: 53, Dst Port: 34238
    Source Port: 53
    Destination Port: 34238
    Length: 74
    Checksum: 0x9c45 [unverified]
    [Checksum Status: Unverified]
    [Stream index: 36]
Domain Name System (response)
    Transaction ID: 0x3ba2
    Flags: 0x8580 Standard query response, No error
        1... .... .... .... = Response: Message is a response
        .000 0... .... .... = Opcode: Standard query (0)
        .... .1.. .... .... = Authoritative: Server is an authority for domain
        .... ..0. .... .... = Truncated: Message is not truncated
        .... ...1 .... .... = Recursion desired: Do query recursively
        .... .... 1... .... = Recursion available: Server can do recursive queries
        .... .... .0.. .... = Z: reserved (0)
        .... .... ..0. .... = Answer authenticated: Answer/authority portion was not authenticated by the server
        .... .... ...0 .... = Non-authenticated data: Unacceptable
        .... .... .... 0000 = Reply code: No error (0)
    Questions: 1
    Answer RRs: 1
    Authority RRs: 0
    Additional RRs: 0
    Queries
        exp1.rnea.comm.eng.osaka-u.ac.jp: type A, class IN
            Name: exp1.rnea.comm.eng.osaka-u.ac.jp
            [Name Length: 32]
            [Label Count: 7]
            Type: A (Host Address) (1)
            Class: IN (0x0001)
    Answers
        exp1.rnea.comm.eng.osaka-u.ac.jp: type A, class IN, addr 192.168.12.23
            Name: exp1.rnea.comm.eng.osaka-u.ac.jp
            Type: A (Host Address) (1)
            Class: IN (0x0001)
            Time to live: 2525 (42 minutes, 5 seconds)
            Data length: 4
            Address: 192.168.12.23
    [Request In: 2140]
    [Time: 0.001049734 seconds]

No.     Time        Source                Destination           Protocol Length Info
   2143 18.971896   10.144.0.1            192.168.12.66         DNS      144    Standard query response 0x43a2 No such name AAAA exp1.rnea.comm.eng.osaka-u.ac.jp SOA gene.comm.eng.osaka-u.ac.jp

Frame 2143: 144 bytes on wire (1152 bits), 144 bytes captured (1152 bits) on interface 0
    Interface id: 0 (eth0)
        Interface name: eth0
    Encapsulation type: Ethernet (1)
    Arrival Time: May 11, 2021 15:14:02.463620180 JST
    [Time shift for this packet: 0.000000000 seconds]
    Epoch Time: 1620713642.463620180 seconds
    [Time delta from previous captured frame: 0.001518326 seconds]
    [Time delta from previous displayed frame: 0.001518326 seconds]
    [Time since reference or first frame: 18.971896293 seconds]
    Frame Number: 2143
    Frame Length: 144 bytes (1152 bits)
    Capture Length: 144 bytes (1152 bits)
    [Frame is marked: False]
    [Frame is ignored: False]
    [Protocols in frame: eth:ethertype:ip:udp:dns]
    [Coloring Rule Name: UDP]
    [Coloring Rule String: udp]
Ethernet II, Src: AlaxalaN_00:00:0c (00:12:e2:00:00:0c), Dst: Raspberr_9e:bc:b3 (b8:27:eb:9e:bc:b3)
    Destination: Raspberr_9e:bc:b3 (b8:27:eb:9e:bc:b3)
        Address: Raspberr_9e:bc:b3 (b8:27:eb:9e:bc:b3)
        .... ..0. .... .... .... .... = LG bit: Globally unique address (factory default)
        .... ...0 .... .... .... .... = IG bit: Individual address (unicast)
    Source: AlaxalaN_00:00:0c (00:12:e2:00:00:0c)
        Address: AlaxalaN_00:00:0c (00:12:e2:00:00:0c)
        .... ..0. .... .... .... .... = LG bit: Globally unique address (factory default)
        .... ...0 .... .... .... .... = IG bit: Individual address (unicast)
    Type: IPv4 (0x0800)
Internet Protocol Version 4, Src: 10.144.0.1, Dst: 192.168.12.66
    0100 .... = Version: 4
    .... 0101 = Header Length: 20 bytes (5)
    Differentiated Services Field: 0x00 (DSCP: CS0, ECN: Not-ECT)
        0000 00.. = Differentiated Services Codepoint: Default (0)
        .... ..00 = Explicit Congestion Notification: Not ECN-Capable Transport (0)
    Total Length: 130
    Identification: 0x71c3 (29123)
    Flags: 0x0000
        0... .... .... .... = Reserved bit: Not set
        .0.. .... .... .... = Don't fragment: Not set
        ..0. .... .... .... = More fragments: Not set
    Fragment offset: 0
    Time to live: 254
    Protocol: UDP (17)
    Header checksum: 0x732c [validation disabled]
    [Header checksum status: Unverified]
    Source: 10.144.0.1
    Destination: 192.168.12.66
User Datagram Protocol, Src Port: 53, Dst Port: 34238
    Source Port: 53
    Destination Port: 34238
    Length: 110
    Checksum: 0xe4a9 [unverified]
    [Checksum Status: Unverified]
    [Stream index: 36]
Domain Name System (response)
    Transaction ID: 0x43a2
    Flags: 0x8183 Standard query response, No such name
        1... .... .... .... = Response: Message is a response
        .000 0... .... .... = Opcode: Standard query (0)
        .... .0.. .... .... = Authoritative: Server is not an authority for domain
        .... ..0. .... .... = Truncated: Message is not truncated
        .... ...1 .... .... = Recursion desired: Do query recursively
        .... .... 1... .... = Recursion available: Server can do recursive queries
        .... .... .0.. .... = Z: reserved (0)
        .... .... ..0. .... = Answer authenticated: Answer/authority portion was not authenticated by the server
        .... .... ...0 .... = Non-authenticated data: Unacceptable
        .... .... .... 0011 = Reply code: No such name (3)
    Questions: 1
    Answer RRs: 0
    Authority RRs: 1
    Additional RRs: 0
    Queries
        exp1.rnea.comm.eng.osaka-u.ac.jp: type AAAA, class IN
            Name: exp1.rnea.comm.eng.osaka-u.ac.jp
            [Name Length: 32]
            [Label Count: 7]
            Type: AAAA (IPv6 Address) (28)
            Class: IN (0x0001)
    Authoritative nameservers
        comm.eng.osaka-u.ac.jp: type SOA, class IN, mname gene.comm.eng.osaka-u.ac.jp
            Name: comm.eng.osaka-u.ac.jp
            Type: SOA (Start Of a zone of Authority) (6)
            Class: IN (0x0001)
            Time to live: 758 (12 minutes, 38 seconds)
            Data length: 40
            Primary name server: gene.comm.eng.osaka-u.ac.jp
            Responsible authority's mailbox: postmaster.comm.eng.osaka-u.ac.jp
            Serial Number: 2021030300
            Refresh Interval: 3600 (1 hour)
            Retry Interval: 600 (10 minutes)
            Expire limit: 1814400 (21 days)
            Minimum TTL: 1200 (20 minutes)
    [Request In: 2141]
    [Time: 0.002476654 seconds]

No.     Time        Source                Destination           Protocol Length Info
   2144 18.972480   192.168.12.66         192.168.12.23         TCP      74     42522 → 5000 [SYN] Seq=4044280001 Win=64240 Len=0 MSS=1460 SACK_PERM=1 TSval=3712487604 TSecr=0 WS=128

Frame 2144: 74 bytes on wire (592 bits), 74 bytes captured (592 bits) on interface 0
    Interface id: 0 (eth0)
        Interface name: eth0
    Encapsulation type: Ethernet (1)
    Arrival Time: May 11, 2021 15:14:02.464204031 JST
    [Time shift for this packet: 0.000000000 seconds]
    Epoch Time: 1620713642.464204031 seconds
    [Time delta from previous captured frame: 0.000583851 seconds]
    [Time delta from previous displayed frame: 0.000583851 seconds]
    [Time since reference or first frame: 18.972480144 seconds]
    Frame Number: 2144
    Frame Length: 74 bytes (592 bits)
    Capture Length: 74 bytes (592 bits)
    [Frame is marked: False]
    [Frame is ignored: False]
    [Protocols in frame: eth:ethertype:ip:tcp]
    [Coloring Rule Name: TCP SYN/FIN]
    [Coloring Rule String: tcp.flags & 0x02 || tcp.flags.fin == 1]
Ethernet II, Src: Raspberr_9e:bc:b3 (b8:27:eb:9e:bc:b3), Dst: HewlettP_a4:d5:90 (f8:b4:6a:a4:d5:90)
    Destination: HewlettP_a4:d5:90 (f8:b4:6a:a4:d5:90)
        Address: HewlettP_a4:d5:90 (f8:b4:6a:a4:d5:90)
        .... ..0. .... .... .... .... = LG bit: Globally unique address (factory default)
        .... ...0 .... .... .... .... = IG bit: Individual address (unicast)
    Source: Raspberr_9e:bc:b3 (b8:27:eb:9e:bc:b3)
        Address: Raspberr_9e:bc:b3 (b8:27:eb:9e:bc:b3)
        .... ..0. .... .... .... .... = LG bit: Globally unique address (factory default)
        .... ...0 .... .... .... .... = IG bit: Individual address (unicast)
    Type: IPv4 (0x0800)
Internet Protocol Version 4, Src: 192.168.12.66, Dst: 192.168.12.23
    0100 .... = Version: 4
    .... 0101 = Header Length: 20 bytes (5)
    Differentiated Services Field: 0x00 (DSCP: CS0, ECN: Not-ECT)
        0000 00.. = Differentiated Services Codepoint: Default (0)
        .... ..00 = Explicit Congestion Notification: Not ECN-Capable Transport (0)
    Total Length: 60
    Identification: 0xe8f6 (59638)
    Flags: 0x4000, Don't fragment
        0... .... .... .... = Reserved bit: Not set
        .1.. .... .... .... = Don't fragment: Set
        ..0. .... .... .... = More fragments: Not set
    Fragment offset: 0
    Time to live: 64
    Protocol: TCP (6)
    Header checksum: 0xb81b [validation disabled]
    [Header checksum status: Unverified]
    Source: 192.168.12.66
    Destination: 192.168.12.23
Transmission Control Protocol, Src Port: 42522, Dst Port: 5000, Seq: 4044280001, Len: 0
    Source Port: 42522
    Destination Port: 5000
    [Stream index: 1]
    [TCP Segment Len: 0]
    Sequence number: 4044280001
    [Next sequence number: 4044280001]
    Acknowledgment number: 0
    1010 .... = Header Length: 40 bytes (10)
    Flags: 0x002 (SYN)
        000. .... .... = Reserved: Not set
        ...0 .... .... = Nonce: Not set
        .... 0... .... = Congestion Window Reduced (CWR): Not set
        .... .0.. .... = ECN-Echo: Not set
        .... ..0. .... = Urgent: Not set
        .... ...0 .... = Acknowledgment: Not set
        .... .... 0... = Push: Not set
        .... .... .0.. = Reset: Not set
        .... .... ..1. = Syn: Set
            [Expert Info (Chat/Sequence): Connection establish request (SYN): server port 5000]
                [Connection establish request (SYN): server port 5000]
                [Severity level: Chat]
                [Group: Sequence]
        .... .... ...0 = Fin: Not set
        [TCP Flags: ··········S·]
    Window size value: 64240
    [Calculated window size: 64240]
    Checksum: 0x99d8 [unverified]
    [Checksum Status: Unverified]
    Urgent pointer: 0
    Options: (20 bytes), Maximum segment size, SACK permitted, Timestamps, No-Operation (NOP), Window scale
        TCP Option - Maximum segment size: 1460 bytes
            Kind: Maximum Segment Size (2)
            Length: 4
            MSS Value: 1460
        TCP Option - SACK permitted
            Kind: SACK Permitted (4)
            Length: 2
        TCP Option - Timestamps: TSval 3712487604, TSecr 0
            Kind: Time Stamp Option (8)
            Length: 10
            Timestamp value: 3712487604
            Timestamp echo reply: 0
        TCP Option - No-Operation (NOP)
            Kind: No-Operation (1)
        TCP Option - Window scale: 7 (multiply by 128)
            Kind: Window Scale (3)
            Length: 3
            Shift count: 7
            [Multiplier: 128]
    [Timestamps]
        [Time since first frame in this TCP stream: 0.000000000 seconds]
        [Time since previous frame in this TCP stream: 0.000000000 seconds]

No.     Time        Source                Destination           Protocol Length Info
   2145 18.974209   192.168.12.23         192.168.12.66         TCP      74     5000 → 42522 [SYN, ACK] Seq=1438445294 Ack=4044280002 Win=65160 Len=0 MSS=1460 SACK_PERM=1 TSval=2689562944 TSecr=3712487604 WS=128

Frame 2145: 74 bytes on wire (592 bits), 74 bytes captured (592 bits) on interface 0
    Interface id: 0 (eth0)
        Interface name: eth0
    Encapsulation type: Ethernet (1)
    Arrival Time: May 11, 2021 15:14:02.465933137 JST
    [Time shift for this packet: 0.000000000 seconds]
    Epoch Time: 1620713642.465933137 seconds
    [Time delta from previous captured frame: 0.001729106 seconds]
    [Time delta from previous displayed frame: 0.001729106 seconds]
    [Time since reference or first frame: 18.974209250 seconds]
    Frame Number: 2145
    Frame Length: 74 bytes (592 bits)
    Capture Length: 74 bytes (592 bits)
    [Frame is marked: False]
    [Frame is ignored: False]
    [Protocols in frame: eth:ethertype:ip:tcp]
    [Coloring Rule Name: TCP SYN/FIN]
    [Coloring Rule String: tcp.flags & 0x02 || tcp.flags.fin == 1]
Ethernet II, Src: HewlettP_a4:d5:90 (f8:b4:6a:a4:d5:90), Dst: Raspberr_9e:bc:b3 (b8:27:eb:9e:bc:b3)
    Destination: Raspberr_9e:bc:b3 (b8:27:eb:9e:bc:b3)
        Address: Raspberr_9e:bc:b3 (b8:27:eb:9e:bc:b3)
        .... ..0. .... .... .... .... = LG bit: Globally unique address (factory default)
        .... ...0 .... .... .... .... = IG bit: Individual address (unicast)
    Source: HewlettP_a4:d5:90 (f8:b4:6a:a4:d5:90)
        Address: HewlettP_a4:d5:90 (f8:b4:6a:a4:d5:90)
        .... ..0. .... .... .... .... = LG bit: Globally unique address (factory default)
        .... ...0 .... .... .... .... = IG bit: Individual address (unicast)
    Type: IPv4 (0x0800)
Internet Protocol Version 4, Src: 192.168.12.23, Dst: 192.168.12.66
    0100 .... = Version: 4
    .... 0101 = Header Length: 20 bytes (5)
    Differentiated Services Field: 0x00 (DSCP: CS0, ECN: Not-ECT)
        0000 00.. = Differentiated Services Codepoint: Default (0)
        .... ..00 = Explicit Congestion Notification: Not ECN-Capable Transport (0)
    Total Length: 60
    Identification: 0x0000 (0)
    Flags: 0x4000, Don't fragment
        0... .... .... .... = Reserved bit: Not set
        .1.. .... .... .... = Don't fragment: Set
        ..0. .... .... .... = More fragments: Not set
    Fragment offset: 0
    Time to live: 64
    Protocol: TCP (6)
    Header checksum: 0xa112 [validation disabled]
    [Header checksum status: Unverified]
    Source: 192.168.12.23
    Destination: 192.168.12.66
Transmission Control Protocol, Src Port: 5000, Dst Port: 42522, Seq: 1438445294, Ack: 4044280002, Len: 0
    Source Port: 5000
    Destination Port: 42522
    [Stream index: 1]
    [TCP Segment Len: 0]
    Sequence number: 1438445294
    [Next sequence number: 1438445294]
    Acknowledgment number: 4044280002
    1010 .... = Header Length: 40 bytes (10)
    Flags: 0x012 (SYN, ACK)
        000. .... .... = Reserved: Not set
        ...0 .... .... = Nonce: Not set
        .... 0... .... = Congestion Window Reduced (CWR): Not set
        .... .0.. .... = ECN-Echo: Not set
        .... ..0. .... = Urgent: Not set
        .... ...1 .... = Acknowledgment: Set
        .... .... 0... = Push: Not set
        .... .... .0.. = Reset: Not set
        .... .... ..1. = Syn: Set
            [Expert Info (Chat/Sequence): Connection establish acknowledge (SYN+ACK): server port 5000]
                [Connection establish acknowledge (SYN+ACK): server port 5000]
                [Severity level: Chat]
                [Group: Sequence]
        .... .... ...0 = Fin: Not set
        [TCP Flags: ·······A··S·]
    Window size value: 65160
    [Calculated window size: 65160]
    Checksum: 0xe810 [unverified]
    [Checksum Status: Unverified]
    Urgent pointer: 0
    Options: (20 bytes), Maximum segment size, SACK permitted, Timestamps, No-Operation (NOP), Window scale
        TCP Option - Maximum segment size: 1460 bytes
            Kind: Maximum Segment Size (2)
            Length: 4
            MSS Value: 1460
        TCP Option - SACK permitted
            Kind: SACK Permitted (4)
            Length: 2
        TCP Option - Timestamps: TSval 2689562944, TSecr 3712487604
            Kind: Time Stamp Option (8)
            Length: 10
            Timestamp value: 2689562944
            Timestamp echo reply: 3712487604
        TCP Option - No-Operation (NOP)
            Kind: No-Operation (1)
        TCP Option - Window scale: 7 (multiply by 128)
            Kind: Window Scale (3)
            Length: 3
            Shift count: 7
            [Multiplier: 128]
    [SEQ/ACK analysis]
        [This is an ACK to the segment in frame: 2144]
        [The RTT to ACK the segment was: 0.001729106 seconds]
        [iRTT: 0.001813898 seconds]
    [Timestamps]
        [Time since first frame in this TCP stream: 0.001729106 seconds]
        [Time since previous frame in this TCP stream: 0.001729106 seconds]

No.     Time        Source                Destination           Protocol Length Info
   2146 18.974294   192.168.12.66         192.168.12.23         TCP      66     42522 → 5000 [ACK] Seq=4044280002 Ack=1438445295 Win=64256 Len=0 TSval=3712487606 TSecr=2689562944

Frame 2146: 66 bytes on wire (528 bits), 66 bytes captured (528 bits) on interface 0
    Interface id: 0 (eth0)
        Interface name: eth0
    Encapsulation type: Ethernet (1)
    Arrival Time: May 11, 2021 15:14:02.466017929 JST
    [Time shift for this packet: 0.000000000 seconds]
    Epoch Time: 1620713642.466017929 seconds
    [Time delta from previous captured frame: 0.000084792 seconds]
    [Time delta from previous displayed frame: 0.000084792 seconds]
    [Time since reference or first frame: 18.974294042 seconds]
    Frame Number: 2146
    Frame Length: 66 bytes (528 bits)
    Capture Length: 66 bytes (528 bits)
    [Frame is marked: False]
    [Frame is ignored: False]
    [Protocols in frame: eth:ethertype:ip:tcp]
    [Coloring Rule Name: TCP]
    [Coloring Rule String: tcp]
Ethernet II, Src: Raspberr_9e:bc:b3 (b8:27:eb:9e:bc:b3), Dst: HewlettP_a4:d5:90 (f8:b4:6a:a4:d5:90)
    Destination: HewlettP_a4:d5:90 (f8:b4:6a:a4:d5:90)
        Address: HewlettP_a4:d5:90 (f8:b4:6a:a4:d5:90)
        .... ..0. .... .... .... .... = LG bit: Globally unique address (factory default)
        .... ...0 .... .... .... .... = IG bit: Individual address (unicast)
    Source: Raspberr_9e:bc:b3 (b8:27:eb:9e:bc:b3)
        Address: Raspberr_9e:bc:b3 (b8:27:eb:9e:bc:b3)
        .... ..0. .... .... .... .... = LG bit: Globally unique address (factory default)
        .... ...0 .... .... .... .... = IG bit: Individual address (unicast)
    Type: IPv4 (0x0800)
Internet Protocol Version 4, Src: 192.168.12.66, Dst: 192.168.12.23
    0100 .... = Version: 4
    .... 0101 = Header Length: 20 bytes (5)
    Differentiated Services Field: 0x00 (DSCP: CS0, ECN: Not-ECT)
        0000 00.. = Differentiated Services Codepoint: Default (0)
        .... ..00 = Explicit Congestion Notification: Not ECN-Capable Transport (0)
    Total Length: 52
    Identification: 0xe8f7 (59639)
    Flags: 0x4000, Don't fragment
        0... .... .... .... = Reserved bit: Not set
        .1.. .... .... .... = Don't fragment: Set
        ..0. .... .... .... = More fragments: Not set
    Fragment offset: 0
    Time to live: 64
    Protocol: TCP (6)
    Header checksum: 0xb822 [validation disabled]
    [Header checksum status: Unverified]
    Source: 192.168.12.66
    Destination: 192.168.12.23
Transmission Control Protocol, Src Port: 42522, Dst Port: 5000, Seq: 4044280002, Ack: 1438445295, Len: 0
    Source Port: 42522
    Destination Port: 5000
    [Stream index: 1]
    [TCP Segment Len: 0]
    Sequence number: 4044280002
    [Next sequence number: 4044280002]
    Acknowledgment number: 1438445295
    1000 .... = Header Length: 32 bytes (8)
    Flags: 0x010 (ACK)
        000. .... .... = Reserved: Not set
        ...0 .... .... = Nonce: Not set
        .... 0... .... = Congestion Window Reduced (CWR): Not set
        .... .0.. .... = ECN-Echo: Not set
        .... ..0. .... = Urgent: Not set
        .... ...1 .... = Acknowledgment: Set
        .... .... 0... = Push: Not set
        .... .... .0.. = Reset: Not set
        .... .... ..0. = Syn: Not set
        .... .... ...0 = Fin: Not set
        [TCP Flags: ·······A····]
    Window size value: 502
    [Calculated window size: 64256]
    [Window size scaling factor: 128]
    Checksum: 0x99d0 [unverified]
    [Checksum Status: Unverified]
    Urgent pointer: 0
    Options: (12 bytes), No-Operation (NOP), No-Operation (NOP), Timestamps
        TCP Option - No-Operation (NOP)
            Kind: No-Operation (1)
        TCP Option - No-Operation (NOP)
            Kind: No-Operation (1)
        TCP Option - Timestamps: TSval 3712487606, TSecr 2689562944
            Kind: Time Stamp Option (8)
            Length: 10
            Timestamp value: 3712487606
            Timestamp echo reply: 2689562944
    [SEQ/ACK analysis]
        [This is an ACK to the segment in frame: 2145]
        [The RTT to ACK the segment was: 0.000084792 seconds]
        [iRTT: 0.001813898 seconds]
    [Timestamps]
        [Time since first frame in this TCP stream: 0.001813898 seconds]
        [Time since previous frame in this TCP stream: 0.000084792 seconds]

No.     Time        Source                Destination           Protocol Length Info
   2147 18.974476   192.168.12.66         192.168.12.23         IPA      227    unknown 0x53 

Frame 2147: 227 bytes on wire (1816 bits), 227 bytes captured (1816 bits) on interface 0
    Interface id: 0 (eth0)
        Interface name: eth0
    Encapsulation type: Ethernet (1)
    Arrival Time: May 11, 2021 15:14:02.466200740 JST
    [Time shift for this packet: 0.000000000 seconds]
    Epoch Time: 1620713642.466200740 seconds
    [Time delta from previous captured frame: 0.000182811 seconds]
    [Time delta from previous displayed frame: 0.000182811 seconds]
    [Time since reference or first frame: 18.974476853 seconds]
    Frame Number: 2147
    Frame Length: 227 bytes (1816 bits)
    Capture Length: 227 bytes (1816 bits)
    [Frame is marked: False]
    [Frame is ignored: False]
    [Protocols in frame: eth:ethertype:ip:tcp:gsm_ipa]
    [Coloring Rule Name: TCP]
    [Coloring Rule String: tcp]
Ethernet II, Src: Raspberr_9e:bc:b3 (b8:27:eb:9e:bc:b3), Dst: HewlettP_a4:d5:90 (f8:b4:6a:a4:d5:90)
    Destination: HewlettP_a4:d5:90 (f8:b4:6a:a4:d5:90)
        Address: HewlettP_a4:d5:90 (f8:b4:6a:a4:d5:90)
        .... ..0. .... .... .... .... = LG bit: Globally unique address (factory default)
        .... ...0 .... .... .... .... = IG bit: Individual address (unicast)
    Source: Raspberr_9e:bc:b3 (b8:27:eb:9e:bc:b3)
        Address: Raspberr_9e:bc:b3 (b8:27:eb:9e:bc:b3)
        .... ..0. .... .... .... .... = LG bit: Globally unique address (factory default)
        .... ...0 .... .... .... .... = IG bit: Individual address (unicast)
    Type: IPv4 (0x0800)
Internet Protocol Version 4, Src: 192.168.12.66, Dst: 192.168.12.23
    0100 .... = Version: 4
    .... 0101 = Header Length: 20 bytes (5)
    Differentiated Services Field: 0x00 (DSCP: CS0, ECN: Not-ECT)
        0000 00.. = Differentiated Services Codepoint: Default (0)
        .... ..00 = Explicit Congestion Notification: Not ECN-Capable Transport (0)
    Total Length: 213
    Identification: 0xe8f8 (59640)
    Flags: 0x4000, Don't fragment
        0... .... .... .... = Reserved bit: Not set
        .1.. .... .... .... = Don't fragment: Set
        ..0. .... .... .... = More fragments: Not set
    Fragment offset: 0
    Time to live: 64
    Protocol: TCP (6)
    Header checksum: 0xb780 [validation disabled]
    [Header checksum status: Unverified]
    Source: 192.168.12.66
    Destination: 192.168.12.23
Transmission Control Protocol, Src Port: 42522, Dst Port: 5000, Seq: 4044280002, Ack: 1438445295, Len: 161
    Source Port: 42522
    Destination Port: 5000
    [Stream index: 1]
    [TCP Segment Len: 161]
    Sequence number: 4044280002
    [Next sequence number: 4044280163]
    Acknowledgment number: 1438445295
    1000 .... = Header Length: 32 bytes (8)
    Flags: 0x018 (PSH, ACK)
        000. .... .... = Reserved: Not set
        ...0 .... .... = Nonce: Not set
        .... 0... .... = Congestion Window Reduced (CWR): Not set
        .... .0.. .... = ECN-Echo: Not set
        .... ..0. .... = Urgent: Not set
        .... ...1 .... = Acknowledgment: Set
        .... .... 1... = Push: Set
        .... .... .0.. = Reset: Not set
        .... .... ..0. = Syn: Not set
        .... .... ...0 = Fin: Not set
        [TCP Flags: ·······AP···]
    Window size value: 502
    [Calculated window size: 64256]
    [Window size scaling factor: 128]
    Checksum: 0x9a71 [unverified]
    [Checksum Status: Unverified]
    Urgent pointer: 0
    Options: (12 bytes), No-Operation (NOP), No-Operation (NOP), Timestamps
        TCP Option - No-Operation (NOP)
            Kind: No-Operation (1)
        TCP Option - No-Operation (NOP)
            Kind: No-Operation (1)
        TCP Option - Timestamps: TSval 3712487606, TSecr 2689562944
            Kind: Time Stamp Option (8)
            Length: 10
            Timestamp value: 3712487606
            Timestamp echo reply: 2689562944
    [SEQ/ACK analysis]
        [iRTT: 0.001813898 seconds]
        [Bytes in flight: 161]
        [Bytes sent since last PSH flag: 161]
    [Timestamps]
        [Time since first frame in this TCP stream: 0.001996709 seconds]
        [Time since previous frame in this TCP stream: 0.000182811 seconds]
    TCP payload (161 bytes)
IPA protocol ip.access, type: unknown 0x53
    DataLen: 20559
    Protocol: Unknown (0x53)

No.     Time        Source                Destination           Protocol Length Info
   2148 18.974618   192.168.12.66         192.168.12.23         IPA      1514   unknown 0x4e 

Frame 2148: 1514 bytes on wire (12112 bits), 1514 bytes captured (12112 bits) on interface 0
    Interface id: 0 (eth0)
        Interface name: eth0
    Encapsulation type: Ethernet (1)
    Arrival Time: May 11, 2021 15:14:02.466341989 JST
    [Time shift for this packet: 0.000000000 seconds]
    Epoch Time: 1620713642.466341989 seconds
    [Time delta from previous captured frame: 0.000141249 seconds]
    [Time delta from previous displayed frame: 0.000141249 seconds]
    [Time since reference or first frame: 18.974618102 seconds]
    Frame Number: 2148
    Frame Length: 1514 bytes (12112 bits)
    Capture Length: 1514 bytes (12112 bits)
    [Frame is marked: False]
    [Frame is ignored: False]
    [Protocols in frame: eth:ethertype:ip:tcp:gsm_ipa]
    [Coloring Rule Name: TCP]
    [Coloring Rule String: tcp]
Ethernet II, Src: Raspberr_9e:bc:b3 (b8:27:eb:9e:bc:b3), Dst: HewlettP_a4:d5:90 (f8:b4:6a:a4:d5:90)
    Destination: HewlettP_a4:d5:90 (f8:b4:6a:a4:d5:90)
        Address: HewlettP_a4:d5:90 (f8:b4:6a:a4:d5:90)
        .... ..0. .... .... .... .... = LG bit: Globally unique address (factory default)
        .... ...0 .... .... .... .... = IG bit: Individual address (unicast)
    Source: Raspberr_9e:bc:b3 (b8:27:eb:9e:bc:b3)
        Address: Raspberr_9e:bc:b3 (b8:27:eb:9e:bc:b3)
        .... ..0. .... .... .... .... = LG bit: Globally unique address (factory default)
        .... ...0 .... .... .... .... = IG bit: Individual address (unicast)
    Type: IPv4 (0x0800)
Internet Protocol Version 4, Src: 192.168.12.66, Dst: 192.168.12.23
    0100 .... = Version: 4
    .... 0101 = Header Length: 20 bytes (5)
    Differentiated Services Field: 0x00 (DSCP: CS0, ECN: Not-ECT)
        0000 00.. = Differentiated Services Codepoint: Default (0)
        .... ..00 = Explicit Congestion Notification: Not ECN-Capable Transport (0)
    Total Length: 1500
    Identification: 0xe8f9 (59641)
    Flags: 0x4000, Don't fragment
        0... .... .... .... = Reserved bit: Not set
        .1.. .... .... .... = Don't fragment: Set
        ..0. .... .... .... = More fragments: Not set
    Fragment offset: 0
    Time to live: 64
    Protocol: TCP (6)
    Header checksum: 0xb278 [validation disabled]
    [Header checksum status: Unverified]
    Source: 192.168.12.66
    Destination: 192.168.12.23
Transmission Control Protocol, Src Port: 42522, Dst Port: 5000, Seq: 4044280163, Ack: 1438445295, Len: 1448
    Source Port: 42522
    Destination Port: 5000
    [Stream index: 1]
    [TCP Segment Len: 1448]
    Sequence number: 4044280163
    [Next sequence number: 4044281611]
    Acknowledgment number: 1438445295
    1000 .... = Header Length: 32 bytes (8)
    Flags: 0x010 (ACK)
        000. .... .... = Reserved: Not set
        ...0 .... .... = Nonce: Not set
        .... 0... .... = Congestion Window Reduced (CWR): Not set
        .... .0.. .... = ECN-Echo: Not set
        .... ..0. .... = Urgent: Not set
        .... ...1 .... = Acknowledgment: Set
        .... .... 0... = Push: Not set
        .... .... .0.. = Reset: Not set
        .... .... ..0. = Syn: Not set
        .... .... ...0 = Fin: Not set
        [TCP Flags: ·······A····]
    Window size value: 502
    [Calculated window size: 64256]
    [Window size scaling factor: 128]
    Checksum: 0x9f78 [unverified]
    [Checksum Status: Unverified]
    Urgent pointer: 0
    Options: (12 bytes), No-Operation (NOP), No-Operation (NOP), Timestamps
        TCP Option - No-Operation (NOP)
            Kind: No-Operation (1)
        TCP Option - No-Operation (NOP)
            Kind: No-Operation (1)
        TCP Option - Timestamps: TSval 3712487606, TSecr 2689562944
            Kind: Time Stamp Option (8)
            Length: 10
            Timestamp value: 3712487606
            Timestamp echo reply: 2689562944
    [SEQ/ACK analysis]
        [iRTT: 0.001813898 seconds]
        [Bytes in flight: 1609]
        [Bytes sent since last PSH flag: 1448]
    [Timestamps]
        [Time since first frame in this TCP stream: 0.002137958 seconds]
        [Time since previous frame in this TCP stream: 0.000141249 seconds]
    TCP payload (1448 bytes)
IPA protocol ip.access, type: unknown 0x4e
    DataLen: 35152
    Protocol: Unknown (0x4e)

No.     Time        Source                Destination           Protocol Length Info
   2149 18.974640   192.168.12.66         192.168.12.23         IPA      1514   unknown 0x6e 

Frame 2149: 1514 bytes on wire (12112 bits), 1514 bytes captured (12112 bits) on interface 0
    Interface id: 0 (eth0)
        Interface name: eth0
    Encapsulation type: Ethernet (1)
    Arrival Time: May 11, 2021 15:14:02.466364125 JST
    [Time shift for this packet: 0.000000000 seconds]
    Epoch Time: 1620713642.466364125 seconds
    [Time delta from previous captured frame: 0.000022136 seconds]
    [Time delta from previous displayed frame: 0.000022136 seconds]
    [Time since reference or first frame: 18.974640238 seconds]
    Frame Number: 2149
    Frame Length: 1514 bytes (12112 bits)
    Capture Length: 1514 bytes (12112 bits)
    [Frame is marked: False]
    [Frame is ignored: False]
    [Protocols in frame: eth:ethertype:ip:tcp:gsm_ipa]
    [Coloring Rule Name: TCP]
    [Coloring Rule String: tcp]
