No.     Time        Source                Destination           Protocol Length Info
   1019 18.650095   192.168.12.66         10.144.0.1            DNS      88     Standard query 0xfa8f A www2b.comm.eng.osaka-u.ac.jp

Frame 1019: 88 bytes on wire (704 bits), 88 bytes captured (704 bits) on interface 0
    Interface id: 0 (eth0)
        Interface name: eth0
    Encapsulation type: Ethernet (1)
    Arrival Time: May 11, 2021 14:59:53.776072133 JST
    [Time shift for this packet: 0.000000000 seconds]
    Epoch Time: 1620712793.776072133 seconds
    [Time delta from previous captured frame: 0.017258136 seconds]
    [Time delta from previous displayed frame: 0.000000000 seconds]
    [Time since reference or first frame: 18.650095366 seconds]
    Frame Number: 1019
    Frame Length: 88 bytes (704 bits)
    Capture Length: 88 bytes (704 bits)
    [Frame is marked: False]
    [Frame is ignored: False]
    [Protocols in frame: eth:ethertype:ip:udp:dns]
    [Coloring Rule Name: UDP]
    [Coloring Rule String: udp]
Ethernet II, Src: Raspberr_9e:bc:b3 (b8:27:eb:9e:bc:b3), Dst: AlaxalaN_00:00:0c (00:12:e2:00:00:0c)
    Destination: AlaxalaN_00:00:0c (00:12:e2:00:00:0c)
        Address: AlaxalaN_00:00:0c (00:12:e2:00:00:0c)
        .... ..0. .... .... .... .... = LG bit: Globally unique address (factory default)
        .... ...0 .... .... .... .... = IG bit: Individual address (unicast)
    Source: Raspberr_9e:bc:b3 (b8:27:eb:9e:bc:b3)
        Address: Raspberr_9e:bc:b3 (b8:27:eb:9e:bc:b3)
        .... ..0. .... .... .... .... = LG bit: Globally unique address (factory default)
        .... ...0 .... .... .... .... = IG bit: Individual address (unicast)
    Type: IPv4 (0x0800)
Internet Protocol Version 4, Src: 192.168.12.66, Dst: 10.144.0.1
    0100 .... = Version: 4
    .... 0101 = Header Length: 20 bytes (5)
    Differentiated Services Field: 0x00 (DSCP: CS0, ECN: Not-ECT)
        0000 00.. = Differentiated Services Codepoint: Default (0)
        .... ..00 = Explicit Congestion Notification: Not ECN-Capable Transport (0)
    Total Length: 74
    Identification: 0x9e7d (40573)
    Flags: 0x4000, Don't fragment
        0... .... .... .... = Reserved bit: Not set
        .1.. .... .... .... = Don't fragment: Set
        ..0. .... .... .... = More fragments: Not set
    Fragment offset: 0
    Time to live: 64
    Protocol: UDP (17)
    Header checksum: 0xc4aa [validation disabled]
    [Header checksum status: Unverified]
    Source: 192.168.12.66
    Destination: 10.144.0.1
User Datagram Protocol, Src Port: 35759, Dst Port: 53
    Source Port: 35759
    Destination Port: 53
    Length: 54
    Checksum: 0xd7c2 [unverified]
    [Checksum Status: Unverified]
    [Stream index: 15]
Domain Name System (query)
    Transaction ID: 0xfa8f
    Flags: 0x0100 Standard query
        0... .... .... .... = Response: Message is a query
        .000 0... .... .... = Opcode: Standard query (0)
        .... ..0. .... .... = Truncated: Message is not truncated
        .... ...1 .... .... = Recursion desired: Do query recursively
        .... .... .0.. .... = Z: reserved (0)
        .... .... ...0 .... = Non-authenticated data: Unacceptable
    Questions: 1
    Answer RRs: 0
    Authority RRs: 0
    Additional RRs: 0
    Queries
        www2b.comm.eng.osaka-u.ac.jp: type A, class IN
            Name: www2b.comm.eng.osaka-u.ac.jp
            [Name Length: 28]
            [Label Count: 6]
            Type: A (Host Address) (1)
            Class: IN (0x0001)
    [Response In: 1020]

No.     Time        Source                Destination           Protocol Length Info
   1020 18.651080   10.144.0.1            192.168.12.66         DNS      104    Standard query response 0xfa8f A www2b.comm.eng.osaka-u.ac.jp A 192.168.13.80

Frame 1020: 104 bytes on wire (832 bits), 104 bytes captured (832 bits) on interface 0
    Interface id: 0 (eth0)
        Interface name: eth0
    Encapsulation type: Ethernet (1)
    Arrival Time: May 11, 2021 14:59:53.777056974 JST
    [Time shift for this packet: 0.000000000 seconds]
    Epoch Time: 1620712793.777056974 seconds
    [Time delta from previous captured frame: 0.000984841 seconds]
    [Time delta from previous displayed frame: 0.000984841 seconds]
    [Time since reference or first frame: 18.651080207 seconds]
    Frame Number: 1020
    Frame Length: 104 bytes (832 bits)
    Capture Length: 104 bytes (832 bits)
    [Frame is marked: False]
    [Frame is ignored: False]
    [Protocols in frame: eth:ethertype:ip:udp:dns]
    [Coloring Rule Name: UDP]
    [Coloring Rule String: udp]
Ethernet II, Src: AlaxalaN_00:00:0c (00:12:e2:00:00:0c), Dst: Raspberr_9e:bc:b3 (b8:27:eb:9e:bc:b3)
    Destination: Raspberr_9e:bc:b3 (b8:27:eb:9e:bc:b3)
        Address: Raspberr_9e:bc:b3 (b8:27:eb:9e:bc:b3)
        .... ..0. .... .... .... .... = LG bit: Globally unique address (factory default)
        .... ...0 .... .... .... .... = IG bit: Individual address (unicast)
    Source: AlaxalaN_00:00:0c (00:12:e2:00:00:0c)
        Address: AlaxalaN_00:00:0c (00:12:e2:00:00:0c)
        .... ..0. .... .... .... .... = LG bit: Globally unique address (factory default)
        .... ...0 .... .... .... .... = IG bit: Individual address (unicast)
    Type: IPv4 (0x0800)
Internet Protocol Version 4, Src: 10.144.0.1, Dst: 192.168.12.66
    0100 .... = Version: 4
    .... 0101 = Header Length: 20 bytes (5)
    Differentiated Services Field: 0x00 (DSCP: CS0, ECN: Not-ECT)
        0000 00.. = Differentiated Services Codepoint: Default (0)
        .... ..00 = Explicit Congestion Notification: Not ECN-Capable Transport (0)
    Total Length: 90
    Identification: 0x6326 (25382)
    Flags: 0x0000
        0... .... .... .... = Reserved bit: Not set
        .0.. .... .... .... = Don't fragment: Not set
        ..0. .... .... .... = More fragments: Not set
    Fragment offset: 0
    Time to live: 254
    Protocol: UDP (17)
    Header checksum: 0x81f1 [validation disabled]
    [Header checksum status: Unverified]
    Source: 10.144.0.1
    Destination: 192.168.12.66
User Datagram Protocol, Src Port: 53, Dst Port: 35759
    Source Port: 53
    Destination Port: 35759
    Length: 70
    Checksum: 0xb66a [unverified]
    [Checksum Status: Unverified]
    [Stream index: 15]
Domain Name System (response)
    Transaction ID: 0xfa8f
    Flags: 0x8580 Standard query response, No error
        1... .... .... .... = Response: Message is a response
        .000 0... .... .... = Opcode: Standard query (0)
        .... .1.. .... .... = Authoritative: Server is an authority for domain
        .... ..0. .... .... = Truncated: Message is not truncated
        .... ...1 .... .... = Recursion desired: Do query recursively
        .... .... 1... .... = Recursion available: Server can do recursive queries
        .... .... .0.. .... = Z: reserved (0)
        .... .... ..0. .... = Answer authenticated: Answer/authority portion was not authenticated by the server
        .... .... ...0 .... = Non-authenticated data: Unacceptable
        .... .... .... 0000 = Reply code: No error (0)
    Questions: 1
    Answer RRs: 1
    Authority RRs: 0
    Additional RRs: 0
    Queries
        www2b.comm.eng.osaka-u.ac.jp: type A, class IN
            Name: www2b.comm.eng.osaka-u.ac.jp
            [Name Length: 28]
            [Label Count: 6]
            Type: A (Host Address) (1)
            Class: IN (0x0001)
    Answers
        www2b.comm.eng.osaka-u.ac.jp: type A, class IN, addr 192.168.13.80
            Name: www2b.comm.eng.osaka-u.ac.jp
            Type: A (Host Address) (1)
            Class: IN (0x0001)
            Time to live: 1 (1 second)
            Data length: 4
            Address: 192.168.13.80
    [Request In: 1019]
    [Time: 0.000984841 seconds]

No.     Time        Source                Destination           Protocol Length Info
   1032 18.760729   192.168.12.66         192.168.13.80         TCP      74     35530 → 80 [SYN] Seq=268385703 Win=64240 Len=0 MSS=1460 SACK_PERM=1 TSval=3543596857 TSecr=0 WS=128

Frame 1032: 74 bytes on wire (592 bits), 74 bytes captured (592 bits) on interface 0
    Interface id: 0 (eth0)
        Interface name: eth0
    Encapsulation type: Ethernet (1)
    Arrival Time: May 11, 2021 14:59:53.886706762 JST
    [Time shift for this packet: 0.000000000 seconds]
    Epoch Time: 1620712793.886706762 seconds
    [Time delta from previous captured frame: 0.033665179 seconds]
    [Time delta from previous displayed frame: 0.109649788 seconds]
    [Time since reference or first frame: 18.760729995 seconds]
    Frame Number: 1032
    Frame Length: 74 bytes (592 bits)
    Capture Length: 74 bytes (592 bits)
    [Frame is marked: False]
    [Frame is ignored: False]
    [Protocols in frame: eth:ethertype:ip:tcp]
    [Coloring Rule Name: HTTP]
    [Coloring Rule String: http || tcp.port == 80 || http2]
Ethernet II, Src: Raspberr_9e:bc:b3 (b8:27:eb:9e:bc:b3), Dst: AlaxalaN_00:00:0c (00:12:e2:00:00:0c)
    Destination: AlaxalaN_00:00:0c (00:12:e2:00:00:0c)
        Address: AlaxalaN_00:00:0c (00:12:e2:00:00:0c)
        .... ..0. .... .... .... .... = LG bit: Globally unique address (factory default)
        .... ...0 .... .... .... .... = IG bit: Individual address (unicast)
    Source: Raspberr_9e:bc:b3 (b8:27:eb:9e:bc:b3)
        Address: Raspberr_9e:bc:b3 (b8:27:eb:9e:bc:b3)
        .... ..0. .... .... .... .... = LG bit: Globally unique address (factory default)
        .... ...0 .... .... .... .... = IG bit: Individual address (unicast)
    Type: IPv4 (0x0800)
Internet Protocol Version 4, Src: 192.168.12.66, Dst: 192.168.13.80
    0100 .... = Version: 4
    .... 0101 = Header Length: 20 bytes (5)
    Differentiated Services Field: 0x00 (DSCP: CS0, ECN: Not-ECT)
        0000 00.. = Differentiated Services Codepoint: Default (0)
        .... ..00 = Explicit Congestion Notification: Not ECN-Capable Transport (0)
    Total Length: 60
    Identification: 0xa86e (43118)
    Flags: 0x4000, Don't fragment
        0... .... .... .... = Reserved bit: Not set
        .1.. .... .... .... = Don't fragment: Set
        ..0. .... .... .... = More fragments: Not set
    Fragment offset: 0
    Time to live: 64
    Protocol: TCP (6)
    Header checksum: 0xf76a [validation disabled]
    [Header checksum status: Unverified]
    Source: 192.168.12.66
    Destination: 192.168.13.80
Transmission Control Protocol, Src Port: 35530, Dst Port: 80, Seq: 268385703, Len: 0
    Source Port: 35530
    Destination Port: 80
    [Stream index: 5]
    [TCP Segment Len: 0]
    Sequence number: 268385703
    [Next sequence number: 268385703]
    Acknowledgment number: 0
    1010 .... = Header Length: 40 bytes (10)
    Flags: 0x002 (SYN)
        000. .... .... = Reserved: Not set
        ...0 .... .... = Nonce: Not set
        .... 0... .... = Congestion Window Reduced (CWR): Not set
        .... .0.. .... = ECN-Echo: Not set
        .... ..0. .... = Urgent: Not set
        .... ...0 .... = Acknowledgment: Not set
        .... .... 0... = Push: Not set
        .... .... .0.. = Reset: Not set
        .... .... ..1. = Syn: Set
            [Expert Info (Chat/Sequence): Connection establish request (SYN): server port 80]
                [Connection establish request (SYN): server port 80]
                [Severity level: Chat]
                [Group: Sequence]
        .... .... ...0 = Fin: Not set
        [TCP Flags: ··········S·]
    Window size value: 64240
    [Calculated window size: 64240]
    Checksum: 0x9b11 [unverified]
    [Checksum Status: Unverified]
    Urgent pointer: 0
    Options: (20 bytes), Maximum segment size, SACK permitted, Timestamps, No-Operation (NOP), Window scale
        TCP Option - Maximum segment size: 1460 bytes
            Kind: Maximum Segment Size (2)
            Length: 4
            MSS Value: 1460
        TCP Option - SACK permitted
            Kind: SACK Permitted (4)
            Length: 2
        TCP Option - Timestamps: TSval 3543596857, TSecr 0
            Kind: Time Stamp Option (8)
            Length: 10
            Timestamp value: 3543596857
            Timestamp echo reply: 0
        TCP Option - No-Operation (NOP)
            Kind: No-Operation (1)
        TCP Option - Window scale: 7 (multiply by 128)
            Kind: Window Scale (3)
            Length: 3
            Shift count: 7
            [Multiplier: 128]
    [Timestamps]
        [Time since first frame in this TCP stream: 0.000000000 seconds]
        [Time since previous frame in this TCP stream: 0.000000000 seconds]

No.     Time        Source                Destination           Protocol Length Info
   1033 18.761271   192.168.13.80         192.168.12.66         TCP      74     80 → 35530 [SYN, ACK] Seq=4149200285 Ack=268385704 Win=65160 Len=0 MSS=1460 SACK_PERM=1 TSval=1939837156 TSecr=3543596857 WS=128

Frame 1033: 74 bytes on wire (592 bits), 74 bytes captured (592 bits) on interface 0
    Interface id: 0 (eth0)
        Interface name: eth0
    Encapsulation type: Ethernet (1)
    Arrival Time: May 11, 2021 14:59:53.887247959 JST
    [Time shift for this packet: 0.000000000 seconds]
    Epoch Time: 1620712793.887247959 seconds
    [Time delta from previous captured frame: 0.000541197 seconds]
    [Time delta from previous displayed frame: 0.000541197 seconds]
    [Time since reference or first frame: 18.761271192 seconds]
    Frame Number: 1033
    Frame Length: 74 bytes (592 bits)
    Capture Length: 74 bytes (592 bits)
    [Frame is marked: False]
    [Frame is ignored: False]
    [Protocols in frame: eth:ethertype:ip:tcp]
    [Coloring Rule Name: HTTP]
    [Coloring Rule String: http || tcp.port == 80 || http2]
Ethernet II, Src: AlaxalaN_00:00:0c (00:12:e2:00:00:0c), Dst: Raspberr_9e:bc:b3 (b8:27:eb:9e:bc:b3)
    Destination: Raspberr_9e:bc:b3 (b8:27:eb:9e:bc:b3)
        Address: Raspberr_9e:bc:b3 (b8:27:eb:9e:bc:b3)
        .... ..0. .... .... .... .... = LG bit: Globally unique address (factory default)
        .... ...0 .... .... .... .... = IG bit: Individual address (unicast)
    Source: AlaxalaN_00:00:0c (00:12:e2:00:00:0c)
        Address: AlaxalaN_00:00:0c (00:12:e2:00:00:0c)
        .... ..0. .... .... .... .... = LG bit: Globally unique address (factory default)
        .... ...0 .... .... .... .... = IG bit: Individual address (unicast)
    Type: IPv4 (0x0800)
Internet Protocol Version 4, Src: 192.168.13.80, Dst: 192.168.12.66
    0100 .... = Version: 4
    .... 0101 = Header Length: 20 bytes (5)
    Differentiated Services Field: 0x00 (DSCP: CS0, ECN: Not-ECT)
        0000 00.. = Differentiated Services Codepoint: Default (0)
        .... ..00 = Explicit Congestion Notification: Not ECN-Capable Transport (0)
    Total Length: 60
    Identification: 0x0000 (0)
    Flags: 0x4000, Don't fragment
        0... .... .... .... = Reserved bit: Not set
        .1.. .... .... .... = Don't fragment: Set
        ..0. .... .... .... = More fragments: Not set
    Fragment offset: 0
    Time to live: 62
    Protocol: TCP (6)
    Header checksum: 0xa1d9 [validation disabled]
    [Header checksum status: Unverified]
    Source: 192.168.13.80
    Destination: 192.168.12.66
Transmission Control Protocol, Src Port: 80, Dst Port: 35530, Seq: 4149200285, Ack: 268385704, Len: 0
    Source Port: 80
    Destination Port: 35530
    [Stream index: 5]
    [TCP Segment Len: 0]
    Sequence number: 4149200285
    [Next sequence number: 4149200285]
    Acknowledgment number: 268385704
    1010 .... = Header Length: 40 bytes (10)
    Flags: 0x012 (SYN, ACK)
        000. .... .... = Reserved: Not set
        ...0 .... .... = Nonce: Not set
        .... 0... .... = Congestion Window Reduced (CWR): Not set
        .... .0.. .... = ECN-Echo: Not set
        .... ..0. .... = Urgent: Not set
        .... ...1 .... = Acknowledgment: Set
        .... .... 0... = Push: Not set
        .... .... .0.. = Reset: Not set
        .... .... ..1. = Syn: Set
            [Expert Info (Chat/Sequence): Connection establish acknowledge (SYN+ACK): server port 80]
                [Connection establish acknowledge (SYN+ACK): server port 80]
                [Severity level: Chat]
                [Group: Sequence]
        .... .... ...0 = Fin: Not set
        [TCP Flags: ·······A··S·]
    Window size value: 65160
    [Calculated window size: 65160]
    Checksum: 0x41e0 [unverified]
    [Checksum Status: Unverified]
    Urgent pointer: 0
    Options: (20 bytes), Maximum segment size, SACK permitted, Timestamps, No-Operation (NOP), Window scale
        TCP Option - Maximum segment size: 1460 bytes
            Kind: Maximum Segment Size (2)
            Length: 4
            MSS Value: 1460
        TCP Option - SACK permitted
            Kind: SACK Permitted (4)
            Length: 2
        TCP Option - Timestamps: TSval 1939837156, TSecr 3543596857
            Kind: Time Stamp Option (8)
            Length: 10
            Timestamp value: 1939837156
            Timestamp echo reply: 3543596857
        TCP Option - No-Operation (NOP)
            Kind: No-Operation (1)
        TCP Option - Window scale: 7 (multiply by 128)
            Kind: Window Scale (3)
            Length: 3
            Shift count: 7
            [Multiplier: 128]
    [SEQ/ACK analysis]
        [This is an ACK to the segment in frame: 1032]
        [The RTT to ACK the segment was: 0.000541197 seconds]
        [iRTT: 0.000666665 seconds]
    [Timestamps]
        [Time since first frame in this TCP stream: 0.000541197 seconds]
        [Time since previous frame in this TCP stream: 0.000541197 seconds]

No.     Time        Source                Destination           Protocol Length Info
   1034 18.761396   192.168.12.66         192.168.13.80         TCP      66     35530 → 80 [ACK] Seq=268385704 Ack=4149200286 Win=64256 Len=0 TSval=3543596857 TSecr=1939837156

Frame 1034: 66 bytes on wire (528 bits), 66 bytes captured (528 bits) on interface 0
    Interface id: 0 (eth0)
        Interface name: eth0
    Encapsulation type: Ethernet (1)
    Arrival Time: May 11, 2021 14:59:53.887373427 JST
    [Time shift for this packet: 0.000000000 seconds]
    Epoch Time: 1620712793.887373427 seconds
    [Time delta from previous captured frame: 0.000125468 seconds]
    [Time delta from previous displayed frame: 0.000125468 seconds]
    [Time since reference or first frame: 18.761396660 seconds]
    Frame Number: 1034
    Frame Length: 66 bytes (528 bits)
    Capture Length: 66 bytes (528 bits)
    [Frame is marked: False]
    [Frame is ignored: False]
    [Protocols in frame: eth:ethertype:ip:tcp]
    [Coloring Rule Name: HTTP]
    [Coloring Rule String: http || tcp.port == 80 || http2]
Ethernet II, Src: Raspberr_9e:bc:b3 (b8:27:eb:9e:bc:b3), Dst: AlaxalaN_00:00:0c (00:12:e2:00:00:0c)
    Destination: AlaxalaN_00:00:0c (00:12:e2:00:00:0c)
        Address: AlaxalaN_00:00:0c (00:12:e2:00:00:0c)
        .... ..0. .... .... .... .... = LG bit: Globally unique address (factory default)
        .... ...0 .... .... .... .... = IG bit: Individual address (unicast)
    Source: Raspberr_9e:bc:b3 (b8:27:eb:9e:bc:b3)
        Address: Raspberr_9e:bc:b3 (b8:27:eb:9e:bc:b3)
        .... ..0. .... .... .... .... = LG bit: Globally unique address (factory default)
        .... ...0 .... .... .... .... = IG bit: Individual address (unicast)
    Type: IPv4 (0x0800)
Internet Protocol Version 4, Src: 192.168.12.66, Dst: 192.168.13.80
    0100 .... = Version: 4
    .... 0101 = Header Length: 20 bytes (5)
    Differentiated Services Field: 0x00 (DSCP: CS0, ECN: Not-ECT)
        0000 00.. = Differentiated Services Codepoint: Default (0)
        .... ..00 = Explicit Congestion Notification: Not ECN-Capable Transport (0)
    Total Length: 52
    Identification: 0xa86f (43119)
    Flags: 0x4000, Don't fragment
        0... .... .... .... = Reserved bit: Not set
        .1.. .... .... .... = Don't fragment: Set
        ..0. .... .... .... = More fragments: Not set
    Fragment offset: 0
    Time to live: 64
    Protocol: TCP (6)
    Header checksum: 0xf771 [validation disabled]
    [Header checksum status: Unverified]
    Source: 192.168.12.66
    Destination: 192.168.13.80
Transmission Control Protocol, Src Port: 35530, Dst Port: 80, Seq: 268385704, Ack: 4149200286, Len: 0
    Source Port: 35530
    Destination Port: 80
    [Stream index: 5]
    [TCP Segment Len: 0]
    Sequence number: 268385704
    [Next sequence number: 268385704]
    Acknowledgment number: 4149200286
    1000 .... = Header Length: 32 bytes (8)
    Flags: 0x010 (ACK)
        000. .... .... = Reserved: Not set
        ...0 .... .... = Nonce: Not set
        .... 0... .... = Congestion Window Reduced (CWR): Not set
        .... .0.. .... = ECN-Echo: Not set
        .... ..0. .... = Urgent: Not set
        .... ...1 .... = Acknowledgment: Set
        .... .... 0... = Push: Not set
        .... .... .0.. = Reset: Not set
        .... .... ..0. = Syn: Not set
        .... .... ...0 = Fin: Not set
        [TCP Flags: ·······A····]
    Window size value: 502
    [Calculated window size: 64256]
    [Window size scaling factor: 128]
    Checksum: 0x9b09 [unverified]
    [Checksum Status: Unverified]
    Urgent pointer: 0
    Options: (12 bytes), No-Operation (NOP), No-Operation (NOP), Timestamps
        TCP Option - No-Operation (NOP)
            Kind: No-Operation (1)
        TCP Option - No-Operation (NOP)
            Kind: No-Operation (1)
        TCP Option - Timestamps: TSval 3543596857, TSecr 1939837156
            Kind: Time Stamp Option (8)
            Length: 10
            Timestamp value: 3543596857
            Timestamp echo reply: 1939837156
    [SEQ/ACK analysis]
        [This is an ACK to the segment in frame: 1033]
        [The RTT to ACK the segment was: 0.000125468 seconds]
        [iRTT: 0.000666665 seconds]
    [Timestamps]
        [Time since first frame in this TCP stream: 0.000666665 seconds]
        [Time since previous frame in this TCP stream: 0.000125468 seconds]

No.     Time        Source                Destination           Protocol Length Info
   1035 18.761708   192.168.12.66         192.168.13.80         HTTP     436    GET /~yoshiaki/C1/page2.html HTTP/1.1 

Frame 1035: 436 bytes on wire (3488 bits), 436 bytes captured (3488 bits) on interface 0
    Interface id: 0 (eth0)
        Interface name: eth0
    Encapsulation type: Ethernet (1)
    Arrival Time: May 11, 2021 14:59:53.887685249 JST
    [Time shift for this packet: 0.000000000 seconds]
    Epoch Time: 1620712793.887685249 seconds
    [Time delta from previous captured frame: 0.000311822 seconds]
    [Time delta from previous displayed frame: 0.000311822 seconds]
    [Time since reference or first frame: 18.761708482 seconds]
    Frame Number: 1035
    Frame Length: 436 bytes (3488 bits)
    Capture Length: 436 bytes (3488 bits)
    [Frame is marked: False]
    [Frame is ignored: False]
    [Protocols in frame: eth:ethertype:ip:tcp:http]
    [Coloring Rule Name: HTTP]
    [Coloring Rule String: http || tcp.port == 80 || http2]
Ethernet II, Src: Raspberr_9e:bc:b3 (b8:27:eb:9e:bc:b3), Dst: AlaxalaN_00:00:0c (00:12:e2:00:00:0c)
    Destination: AlaxalaN_00:00:0c (00:12:e2:00:00:0c)
        Address: AlaxalaN_00:00:0c (00:12:e2:00:00:0c)
        .... ..0. .... .... .... .... = LG bit: Globally unique address (factory default)
        .... ...0 .... .... .... .... = IG bit: Individual address (unicast)
    Source: Raspberr_9e:bc:b3 (b8:27:eb:9e:bc:b3)
        Address: Raspberr_9e:bc:b3 (b8:27:eb:9e:bc:b3)
        .... ..0. .... .... .... .... = LG bit: Globally unique address (factory default)
        .... ...0 .... .... .... .... = IG bit: Individual address (unicast)
    Type: IPv4 (0x0800)
Internet Protocol Version 4, Src: 192.168.12.66, Dst: 192.168.13.80
    0100 .... = Version: 4
    .... 0101 = Header Length: 20 bytes (5)
    Differentiated Services Field: 0x00 (DSCP: CS0, ECN: Not-ECT)
        0000 00.. = Differentiated Services Codepoint: Default (0)
        .... ..00 = Explicit Congestion Notification: Not ECN-Capable Transport (0)
    Total Length: 422
    Identification: 0xa870 (43120)
    Flags: 0x4000, Don't fragment
        0... .... .... .... = Reserved bit: Not set
        .1.. .... .... .... = Don't fragment: Set
        ..0. .... .... .... = More fragments: Not set
    Fragment offset: 0
    Time to live: 64
    Protocol: TCP (6)
    Header checksum: 0xf5fe [validation disabled]
    [Header checksum status: Unverified]
    Source: 192.168.12.66
    Destination: 192.168.13.80
Transmission Control Protocol, Src Port: 35530, Dst Port: 80, Seq: 268385704, Ack: 4149200286, Len: 370
    Source Port: 35530
    Destination Port: 80
    [Stream index: 5]
    [TCP Segment Len: 370]
    Sequence number: 268385704
    [Next sequence number: 268386074]
    Acknowledgment number: 4149200286
    1000 .... = Header Length: 32 bytes (8)
    Flags: 0x018 (PSH, ACK)
        000. .... .... = Reserved: Not set
        ...0 .... .... = Nonce: Not set
        .... 0... .... = Congestion Window Reduced (CWR): Not set
        .... .0.. .... = ECN-Echo: Not set
        .... ..0. .... = Urgent: Not set
        .... ...1 .... = Acknowledgment: Set
        .... .... 1... = Push: Set
        .... .... .0.. = Reset: Not set
        .... .... ..0. = Syn: Not set
        .... .... ...0 = Fin: Not set
        [TCP Flags: ·······AP···]
    Window size value: 502
    [Calculated window size: 64256]
    [Window size scaling factor: 128]
    Checksum: 0x9c7b [unverified]
    [Checksum Status: Unverified]
    Urgent pointer: 0
    Options: (12 bytes), No-Operation (NOP), No-Operation (NOP), Timestamps
        TCP Option - No-Operation (NOP)
            Kind: No-Operation (1)
        TCP Option - No-Operation (NOP)
            Kind: No-Operation (1)
        TCP Option - Timestamps: TSval 3543596858, TSecr 1939837156
            Kind: Time Stamp Option (8)
            Length: 10
            Timestamp value: 3543596858
            Timestamp echo reply: 1939837156
    [SEQ/ACK analysis]
        [iRTT: 0.000666665 seconds]
        [Bytes in flight: 370]
        [Bytes sent since last PSH flag: 370]
    [Timestamps]
        [Time since first frame in this TCP stream: 0.000978487 seconds]
        [Time since previous frame in this TCP stream: 0.000311822 seconds]
    TCP payload (370 bytes)
Hypertext Transfer Protocol
    GET /~yoshiaki/C1/page2.html HTTP/1.1\r\n
        [Expert Info (Chat/Sequence): GET /~yoshiaki/C1/page2.html HTTP/1.1\r\n]
            [GET /~yoshiaki/C1/page2.html HTTP/1.1\r\n]
            [Severity level: Chat]
            [Group: Sequence]
        Request Method: GET
        Request URI: /~yoshiaki/C1/page2.html
        Request Version: HTTP/1.1
    Host: www2b.comm.eng.osaka-u.ac.jp\r\n
    User-Agent: Mozilla/5.0 (X11; Linux armv7l; rv:78.0) Gecko/20100101 Firefox/78.0\r\n
    Accept: text/html,application/xhtml+xml,application/xml;q=0.9,image/webp,*/*;q=0.8\r\n
    Accept-Language: en-US,en;q=0.5\r\n
    Accept-Encoding: gzip, deflate\r\n
    DNT: 1\r\n
    Connection: keep-alive\r\n
    Upgrade-Insecure-Requests: 1\r\n
    \r\n
    [Full request URI: http://www2b.comm.eng.osaka-u.ac.jp/~yoshiaki/C1/page2.html]
    [HTTP request 1/3]
    [Response in frame: 1037]
    [Next request in frame: 1084]

No.     Time        Source                Destination           Protocol Length Info
   1036 18.762236   192.168.13.80         192.168.12.66         TCP      66     80 → 35530 [ACK] Seq=4149200286 Ack=268386074 Win=64896 Len=0 TSval=1939837157 TSecr=3543596858

Frame 1036: 66 bytes on wire (528 bits), 66 bytes captured (528 bits) on interface 0
    Interface id: 0 (eth0)
        Interface name: eth0
    Encapsulation type: Ethernet (1)
    Arrival Time: May 11, 2021 14:59:53.888212904 JST
    [Time shift for this packet: 0.000000000 seconds]
    Epoch Time: 1620712793.888212904 seconds
    [Time delta from previous captured frame: 0.000527655 seconds]
    [Time delta from previous displayed frame: 0.000527655 seconds]
    [Time since reference or first frame: 18.762236137 seconds]
    Frame Number: 1036
    Frame Length: 66 bytes (528 bits)
    Capture Length: 66 bytes (528 bits)
    [Frame is marked: False]
    [Frame is ignored: False]
    [Protocols in frame: eth:ethertype:ip:tcp]
    [Coloring Rule Name: HTTP]
    [Coloring Rule String: http || tcp.port == 80 || http2]
Ethernet II, Src: AlaxalaN_00:00:0c (00:12:e2:00:00:0c), Dst: Raspberr_9e:bc:b3 (b8:27:eb:9e:bc:b3)
    Destination: Raspberr_9e:bc:b3 (b8:27:eb:9e:bc:b3)
        Address: Raspberr_9e:bc:b3 (b8:27:eb:9e:bc:b3)
        .... ..0. .... .... .... .... = LG bit: Globally unique address (factory default)
        .... ...0 .... .... .... .... = IG bit: Individual address (unicast)
    Source: AlaxalaN_00:00:0c (00:12:e2:00:00:0c)
        Address: AlaxalaN_00:00:0c (00:12:e2:00:00:0c)
        .... ..0. .... .... .... .... = LG bit: Globally unique address (factory default)
        .... ...0 .... .... .... .... = IG bit: Individual address (unicast)
    Type: IPv4 (0x0800)
Internet Protocol Version 4, Src: 192.168.13.80, Dst: 192.168.12.66
    0100 .... = Version: 4
    .... 0101 = Header Length: 20 bytes (5)
    Differentiated Services Field: 0x00 (DSCP: CS0, ECN: Not-ECT)
        0000 00.. = Differentiated Services Codepoint: Default (0)
        .... ..00 = Explicit Congestion Notification: Not ECN-Capable Transport (0)
    Total Length: 52
    Identification: 0xe598 (58776)
    Flags: 0x4000, Don't fragment
        0... .... .... .... = Reserved bit: Not set
        .1.. .... .... .... = Don't fragment: Set
        ..0. .... .... .... = More fragments: Not set
    Fragment offset: 0
    Time to live: 62
    Protocol: TCP (6)
    Header checksum: 0xbc48 [validation disabled]
    [Header checksum status: Unverified]
    Source: 192.168.13.80
    Destination: 192.168.12.66
Transmission Control Protocol, Src Port: 80, Dst Port: 35530, Seq: 4149200286, Ack: 268386074, Len: 0
    Source Port: 80
    Destination Port: 35530
    [Stream index: 5]
    [TCP Segment Len: 0]
    Sequence number: 4149200286
    [Next sequence number: 4149200286]
    Acknowledgment number: 268386074
    1000 .... = Header Length: 32 bytes (8)
    Flags: 0x010 (ACK)
        000. .... .... = Reserved: Not set
        ...0 .... .... = Nonce: Not set
        .... 0... .... = Congestion Window Reduced (CWR): Not set
        .... .0.. .... = ECN-Echo: Not set
        .... ..0. .... = Urgent: Not set
        .... ...1 .... = Acknowledgment: Set
        .... .... 0... = Push: Not set
        .... .... .0.. = Reset: Not set
        .... .... ..0. = Syn: Not set
        .... .... ...0 = Fin: Not set
        [TCP Flags: ·······A····]
    Window size value: 507
    [Calculated window size: 64896]
    [Window size scaling factor: 128]
    Checksum: 0x6bc6 [unverified]
    [Checksum Status: Unverified]
    Urgent pointer: 0
    Options: (12 bytes), No-Operation (NOP), No-Operation (NOP), Timestamps
        TCP Option - No-Operation (NOP)
            Kind: No-Operation (1)
        TCP Option - No-Operation (NOP)
            Kind: No-Operation (1)
        TCP Option - Timestamps: TSval 1939837157, TSecr 3543596858
            Kind: Time Stamp Option (8)
            Length: 10
            Timestamp value: 1939837157
            Timestamp echo reply: 3543596858
    [SEQ/ACK analysis]
        [This is an ACK to the segment in frame: 1035]
        [The RTT to ACK the segment was: 0.000527655 seconds]
        [iRTT: 0.000666665 seconds]
    [Timestamps]
        [Time since first frame in this TCP stream: 0.001506142 seconds]
        [Time since previous frame in this TCP stream: 0.000527655 seconds]

No.     Time        Source                Destination           Protocol Length Info
   1037 18.763016   192.168.13.80         192.168.12.66         HTTP     635    HTTP/1.1 200 OK  (text/html)

Frame 1037: 635 bytes on wire (5080 bits), 635 bytes captured (5080 bits) on interface 0
    Interface id: 0 (eth0)
        Interface name: eth0
    Encapsulation type: Ethernet (1)
    Arrival Time: May 11, 2021 14:59:53.888993319 JST
    [Time shift for this packet: 0.000000000 seconds]
    Epoch Time: 1620712793.888993319 seconds
    [Time delta from previous captured frame: 0.000780415 seconds]
    [Time delta from previous displayed frame: 0.000780415 seconds]
    [Time since reference or first frame: 18.763016552 seconds]
    Frame Number: 1037
    Frame Length: 635 bytes (5080 bits)
    Capture Length: 635 bytes (5080 bits)
    [Frame is marked: False]
    [Frame is ignored: False]
    [Protocols in frame: eth:ethertype:ip:tcp:http:data-text-lines]
    [Coloring Rule Name: HTTP]
    [Coloring Rule String: http || tcp.port == 80 || http2]
Ethernet II, Src: AlaxalaN_00:00:0c (00:12:e2:00:00:0c), Dst: Raspberr_9e:bc:b3 (b8:27:eb:9e:bc:b3)
    Destination: Raspberr_9e:bc:b3 (b8:27:eb:9e:bc:b3)
        Address: Raspberr_9e:bc:b3 (b8:27:eb:9e:bc:b3)
        .... ..0. .... .... .... .... = LG bit: Globally unique address (factory default)
        .... ...0 .... .... .... .... = IG bit: Individual address (unicast)
    Source: AlaxalaN_00:00:0c (00:12:e2:00:00:0c)
        Address: AlaxalaN_00:00:0c (00:12:e2:00:00:0c)
        .... ..0. .... .... .... .... = LG bit: Globally unique address (factory default)
        .... ...0 .... .... .... .... = IG bit: Individual address (unicast)
    Type: IPv4 (0x0800)
Internet Protocol Version 4, Src: 192.168.13.80, Dst: 192.168.12.66
    0100 .... = Version: 4
    .... 0101 = Header Length: 20 bytes (5)
    Differentiated Services Field: 0x00 (DSCP: CS0, ECN: Not-ECT)
        0000 00.. = Differentiated Services Codepoint: Default (0)
        .... ..00 = Explicit Congestion Notification: Not ECN-Capable Transport (0)
    Total Length: 621
    Identification: 0xe599 (58777)
    Flags: 0x4000, Don't fragment
        0... .... .... .... = Reserved bit: Not set
        .1.. .... .... .... = Don't fragment: Set
        ..0. .... .... .... = More fragments: Not set
    Fragment offset: 0
    Time to live: 62
    Protocol: TCP (6)
    Header checksum: 0xba0e [validation disabled]
    [Header checksum status: Unverified]
    Source: 192.168.13.80
    Destination: 192.168.12.66
Transmission Control Protocol, Src Port: 80, Dst Port: 35530, Seq: 4149200286, Ack: 268386074, Len: 569
    Source Port: 80
    Destination Port: 35530
    [Stream index: 5]
    [TCP Segment Len: 569]
    Sequence number: 4149200286
    [Next sequence number: 4149200855]
    Acknowledgment number: 268386074
    1000 .... = Header Length: 32 bytes (8)
    Flags: 0x018 (PSH, ACK)
        000. .... .... = Reserved: Not set
        ...0 .... .... = Nonce: Not set
        .... 0... .... = Congestion Window Reduced (CWR): Not set
        .... .0.. .... = ECN-Echo: Not set
        .... ..0. .... = Urgent: Not set
        .... ...1 .... = Acknowledgment: Set
        .... .... 1... = Push: Set
        .... .... .0.. = Reset: Not set
        .... .... ..0. = Syn: Not set
        .... .... ...0 = Fin: Not set
        [TCP Flags: ·······AP···]
    Window size value: 507
    [Calculated window size: 64896]
    [Window size scaling factor: 128]
    Checksum: 0x152d [unverified]
    [Checksum Status: Unverified]
    Urgent pointer: 0
    Options: (12 bytes), No-Operation (NOP), No-Operation (NOP), Timestamps
        TCP Option - No-Operation (NOP)
            Kind: No-Operation (1)
        TCP Option - No-Operation (NOP)
            Kind: No-Operation (1)
        TCP Option - Timestamps: TSval 1939837158, TSecr 3543596858
            Kind: Time Stamp Option (8)
            Length: 10
            Timestamp value: 1939837158
            Timestamp echo reply: 3543596858
    [SEQ/ACK analysis]
        [iRTT: 0.000666665 seconds]
        [Bytes in flight: 569]
        [Bytes sent since last PSH flag: 569]
    [Timestamps]
        [Time since first frame in this TCP stream: 0.002286557 seconds]
        [Time since previous frame in this TCP stream: 0.000780415 seconds]
    TCP payload (569 bytes)
Hypertext Transfer Protocol
    HTTP/1.1 200 OK\r\n
        [Expert Info (Chat/Sequence): HTTP/1.1 200 OK\r\n]
            [HTTP/1.1 200 OK\r\n]
            [Severity level: Chat]
            [Group: Sequence]
        Response Version: HTTP/1.1
        Status Code: 200
        [Status Code Description: OK]
        Response Phrase: OK
    Date: Tue, 11 May 2021 05:59:53 GMT\r\n
    Server: Apache/2.4.41 (Ubuntu)\r\n
    Last-Modified: Thu, 17 Sep 2020 03:12:39 GMT\r\n
    ETag: "119-5af79c1bbefeb-gzip"\r\n
    Accept-Ranges: bytes\r\n
    Vary: Accept-Encoding\r\n
    Content-Encoding: gzip\r\n
    Content-Length: 232\r\n
        [Content length: 232]
    Keep-Alive: timeout=5, max=100\r\n
    Connection: Keep-Alive\r\n
    Content-Type: text/html\r\n
    \r\n
    [HTTP response 1/3]
    [Time since request: 0.001308070 seconds]
    [Request in frame: 1035]
    [Next request in frame: 1084]
    [Next response in frame: 1088]
    [Request URI: http://www2b.comm.eng.osaka-u.ac.jp/~yoshiaki/C1/page2.html]
    Content-encoded entity body (gzip): 232 bytes -> 281 bytes
    File Data: 281 bytes
Line-based text data: text/html (10 lines)
    <!DOCTYPE HTML PUBLIC "-//W3C//DTD HTML 4.01 Transitional//EN" "http://www.w3.org/TR/html4/loose.dtd">\n
    <html lang="en">\n
    <head>\n
    <meta http-equiv="Content-Type" content="text/html"; charset="utf-8" />\n
    <title>Page 1</title>\n
    </head>\n
    <body>\n
    <img src="./helloworld.png">\n
    </body>\n
    </html>\n

No.     Time        Source                Destination           Protocol Length Info
   1038 18.763111   192.168.12.66         192.168.13.80         TCP      66     35530 → 80 [ACK] Seq=268386074 Ack=4149200855 Win=64000 Len=0 TSval=3543596859 TSecr=1939837158

Frame 1038: 66 bytes on wire (528 bits), 66 bytes captured (528 bits) on interface 0
    Interface id: 0 (eth0)
        Interface name: eth0
    Encapsulation type: Ethernet (1)
    Arrival Time: May 11, 2021 14:59:53.889088423 JST
    [Time shift for this packet: 0.000000000 seconds]
    Epoch Time: 1620712793.889088423 seconds
    [Time delta from previous captured frame: 0.000095104 seconds]
    [Time delta from previous displayed frame: 0.000095104 seconds]
    [Time since reference or first frame: 18.763111656 seconds]
    Frame Number: 1038
    Frame Length: 66 bytes (528 bits)
    Capture Length: 66 bytes (528 bits)
    [Frame is marked: False]
    [Frame is ignored: False]
    [Protocols in frame: eth:ethertype:ip:tcp]
    [Coloring Rule Name: HTTP]
    [Coloring Rule String: http || tcp.port == 80 || http2]
Ethernet II, Src: Raspberr_9e:bc:b3 (b8:27:eb:9e:bc:b3), Dst: AlaxalaN_00:00:0c (00:12:e2:00:00:0c)
    Destination: AlaxalaN_00:00:0c (00:12:e2:00:00:0c)
        Address: AlaxalaN_00:00:0c (00:12:e2:00:00:0c)
        .... ..0. .... .... .... .... = LG bit: Globally unique address (factory default)
        .... ...0 .... .... .... .... = IG bit: Individual address (unicast)
    Source: Raspberr_9e:bc:b3 (b8:27:eb:9e:bc:b3)
        Address: Raspberr_9e:bc:b3 (b8:27:eb:9e:bc:b3)
        .... ..0. .... .... .... .... = LG bit: Globally unique address (factory default)
        .... ...0 .... .... .... .... = IG bit: Individual address (unicast)
    Type: IPv4 (0x0800)
Internet Protocol Version 4, Src: 192.168.12.66, Dst: 192.168.13.80
    0100 .... = Version: 4
    .... 0101 = Header Length: 20 bytes (5)
    Differentiated Services Field: 0x00 (DSCP: CS0, ECN: Not-ECT)
        0000 00.. = Differentiated Services Codepoint: Default (0)
        .... ..00 = Explicit Congestion Notification: Not ECN-Capable Transport (0)
    Total Length: 52
    Identification: 0xa871 (43121)
    Flags: 0x4000, Don't fragment
        0... .... .... .... = Reserved bit: Not set
        .1.. .... .... .... = Don't fragment: Set
        ..0. .... .... .... = More fragments: Not set
    Fragment offset: 0
    Time to live: 64
    Protocol: TCP (6)
    Header checksum: 0xf76f [validation disabled]
    [Header checksum status: Unverified]
    Source: 192.168.12.66
    Destination: 192.168.13.80
