No.     Time        Source                Destination           Protocol Length Info
   1019 18.650095   192.168.12.66         10.144.0.1            DNS      88     Standard query 0xfa8f A www2b.comm.eng.osaka-u.ac.jp
   1020 18.651080   10.144.0.1            192.168.12.66         DNS      104    Standard query response 0xfa8f A www2b.comm.eng.osaka-u.ac.jp A 192.168.13.80
   1032 18.760729   192.168.12.66         192.168.13.80         TCP      74     35530 → 80 [SYN] Seq=268385703 Win=64240 Len=0 MSS=1460 SACK_PERM=1 TSval=3543596857 TSecr=0 WS=128
   1033 18.761271   192.168.13.80         192.168.12.66         TCP      74     80 → 35530 [SYN, ACK] Seq=4149200285 Ack=268385704 Win=65160 Len=0 MSS=1460 SACK_PERM=1 TSval=1939837156 TSecr=3543596857 WS=128
   1034 18.761396   192.168.12.66         192.168.13.80         TCP      66     35530 → 80 [ACK] Seq=268385704 Ack=4149200286 Win=64256 Len=0 TSval=3543596857 TSecr=1939837156
   1035 18.761708   192.168.12.66         192.168.13.80         HTTP     436    GET /~yoshiaki/C1/page2.html HTTP/1.1 
   1036 18.762236   192.168.13.80         192.168.12.66         TCP      66     80 → 35530 [ACK] Seq=4149200286 Ack=268386074 Win=64896 Len=0 TSval=1939837157 TSecr=3543596858
   1037 18.763016   192.168.13.80         192.168.12.66         HTTP     635    HTTP/1.1 200 OK  (text/html)
   1038 18.763111   192.168.12.66         192.168.13.80         TCP      66     35530 → 80 [ACK] Seq=268386074 Ack=4149200855 Win=64000 Len=0 TSval=3543596859 TSecr=1939837158
   1084 19.170575   192.168.12.66         192.168.13.80         HTTP     420    GET /~yoshiaki/C1/helloworld.png HTTP/1.1 
   1085 19.171240   192.168.13.80         192.168.12.66         TCP      66     80 → 35530 [ACK] Seq=4149200855 Ack=268386428 Win=64640 Len=0 TSval=1939837566 TSecr=3543597267
   1086 19.171658   192.168.13.80         192.168.12.66         TCP      1514   80 → 35530 [ACK] Seq=4149200855 Ack=268386428 Win=64640 Len=1448 TSval=1939837566 TSecr=3543597267 [TCP segment of a reassembled PDU]
   1087 19.171759   192.168.12.66         192.168.13.80         TCP      66     35530 → 80 [ACK] Seq=268386428 Ack=4149202303 Win=64000 Len=0 TSval=3543597268 TSecr=1939837566
   1088 19.171891   192.168.13.80         192.168.12.66         HTTP     659    HTTP/1.1 200 OK  (PNG)
   1089 19.171954   192.168.12.66         192.168.13.80         TCP      66     35530 → 80 [ACK] Seq=268386428 Ack=4149202896 Win=64000 Len=0 TSval=3543597268 TSecr=1939837566
   1116 19.299075   192.168.12.66         192.168.13.80         HTTP     334    GET /favicon.ico HTTP/1.1 
   1117 19.299679   192.168.13.80         192.168.12.66         TCP      66     80 → 35530 [ACK] Seq=4149202896 Ack=268386696 Win=64384 Len=0 TSval=1939837694 TSecr=3543597395
   1118 19.300124   192.168.13.80         192.168.12.66         HTTP     572    HTTP/1.1 404 Not Found  (text/html)
   1119 19.300232   192.168.12.66         192.168.13.80         TCP      66     35530 → 80 [ACK] Seq=268386696 Ack=4149203402 Win=64000 Len=0 TSval=3543597396 TSecr=1939837695
   1643 24.300291   192.168.13.80         192.168.12.66         TCP      66     80 → 35530 [FIN, ACK] Seq=4149203402 Ack=268386696 Win=64384 Len=0 TSval=1939842695 TSecr=3543597396
   1644 24.300712   192.168.12.66         192.168.13.80         TCP      66     35530 → 80 [FIN, ACK] Seq=268386696 Ack=4149203403 Win=64128 Len=0 TSval=3543602397 TSecr=1939842695
   1645 24.301194   192.168.13.80         192.168.12.66         TCP      66     80 → 35530 [ACK] Seq=4149203403 Ack=268386697 Win=64384 Len=0 TSval=1939842696 TSecr=3543602397
